{
  "id": "top-222268",
  "name": "Gen 1.5 as built",
  "endpoints": [
    {
      "id": "end-222269",
      "kind": "connector",
      "connector": "cmp-22222h/P1"
    },
    {
      "id": "end-22226a",
      "kind": "connector",
      "connector": "cmp-22222c/ETH"
    },
    {
      "id": "end-22226c",
      "kind": "connector",
      "connector": "cmp-22222h/P2"
    },
    {
      "id": "end-22226d",
      "kind": "connector",
      "connector": "cmp-22222j/ETH"
    },
    {
      "id": "end-22226f",
      "kind": "connector",
      "connector": "cmp-22222h/P3"
    },
    {
      "id": "end-22226g",
      "kind": "connector",
      "connector": "cmp-22222f/ETH"
    },
    {
      "id": "end-22226j",
      "kind": "connector",
      "connector": "cmp-22222h/P4"
    },
    {
      "id": "end-22226k",
      "kind": "connector",
      "connector": "cmp-22222g/ETH"
    },
    {
      "id": "end-22226n",
      "kind": "connector",
      "connector": "cmp-22222h/P5"
    },
    {
      "id": "end-22226p",
      "kind": "connector",
      "connector": "cmp-22222q/ETH"
    },
    {
      "id": "end-22226r",
      "kind": "connector",
      "connector": "cmp-22222h/P6"
    },
    {
      "id": "end-22226s",
      "kind": "connector",
      "connector": "cmp-22222t/ETH"
    },
    {
      "id": "end-22226u",
      "kind": "connector",
      "connector": "cmp-22222h/P7"
    },
    {
      "id": "end-22226v",
      "kind": "connector",
      "connector": "cmp-22222w/ETH"
    },
    {
      "id": "end-22226x",
      "kind": "connector",
      "connector": "cmp-22222h/P8"
    },
    {
      "id": "end-22226y",
      "kind": "connector",
      "connector": "cmp-22222z/ETH"
    },
    {
      "id": "end-222272",
      "kind": "connector",
      "connector": "cmp-22222j/CAN-A"
    },
    {
      "id": "end-222273",
      "kind": "connector",
      "connector": "cmp-222234/CAN-A"
    },
    {
      "id": "end-222275",
      "kind": "connector",
      "connector": "cmp-222234/CAN-B"
    },
    {
      "id": "end-222276",
      "kind": "connector",
      "connector": "cmp-222235/CAN-A"
    },
    {
      "id": "end-222278",
      "kind": "connector",
      "connector": "cmp-222235/CAN-B"
    },
    {
      "id": "end-222279",
      "kind": "connector",
      "connector": "cmp-222236/CAN-A"
    },
    {
      "id": "end-22227b",
      "kind": "connector",
      "connector": "cmp-22222c/USB1"
    },
    {
      "id": "end-22227c",
      "kind": "connector",
      "connector": "cmp-22222b/UP"
    },
    {
      "id": "end-22227e",
      "kind": "connector",
      "connector": "cmp-22222b/D1"
    },
    {
      "id": "end-22227f",
      "kind": "connector",
      "connector": "cmp-222229/USB"
    },
    {
      "id": "end-22227h",
      "kind": "connector",
      "connector": "cmp-22222b/D2"
    },
    {
      "id": "end-22227j",
      "kind": "connector",
      "connector": "cmp-22222a/USB"
    },
    {
      "id": "end-22227m",
      "kind": "connector",
      "connector": "cmp-22222c/USB2"
    },
    {
      "id": "end-22227n",
      "kind": "connector",
      "connector": "cmp-22222d/USB"
    },
    {
      "id": "end-22227q",
      "kind": "connector",
      "connector": "cmp-22222c/HDMI"
    },
    {
      "id": "end-22227r",
      "kind": "connector",
      "connector": "cmp-22222d/HDMI"
    },
    {
      "id": "end-22227t",
      "kind": "connector",
      "connector": "cmp-22222c/CAM1"
    },
    {
      "id": "end-22227u",
      "kind": "connector",
      "connector": "cmp-222223/GMSL"
    },
    {
      "id": "end-22227w",
      "kind": "connector",
      "connector": "cmp-22222c/CAM2"
    },
    {
      "id": "end-22227x",
      "kind": "connector",
      "connector": "cmp-222224/GMSL"
    },
    {
      "id": "end-22227z",
      "kind": "connector",
      "connector": "cmp-22222c/CAM3"
    },
    {
      "id": "end-222282",
      "kind": "connector",
      "connector": "cmp-222225/GMSL"
    },
    {
      "id": "end-222284",
      "kind": "connector",
      "connector": "cmp-22222c/CAM4"
    },
    {
      "id": "end-222285",
      "kind": "connector",
      "connector": "cmp-222226/GMSL"
    },
    {
      "id": "end-222287",
      "kind": "connector",
      "connector": "cmp-22222c/CAM5"
    },
    {
      "id": "end-222288",
      "kind": "connector",
      "connector": "cmp-222227/GMSL"
    },
    {
      "id": "end-22228a",
      "kind": "connector",
      "connector": "cmp-22222c/CAM6"
    },
    {
      "id": "end-22228b",
      "kind": "connector",
      "connector": "cmp-222228/GMSL"
    },
    {
      "id": "end-22228d",
      "kind": "connector",
      "connector": "cmp-22222k/MAIN"
    },
    {
      "id": "end-22228e",
      "kind": "connector",
      "connector": "cmp-22222n/IN"
    },
    {
      "id": "end-22228g",
      "kind": "connector",
      "connector": "cmp-22222n/OUT"
    },
    {
      "id": "end-22228h",
      "kind": "connector",
      "connector": "cmp-22222p/BAT"
    },
    {
      "id": "end-22228k",
      "kind": "connector",
      "connector": "cmp-22222k/CHG"
    },
    {
      "id": "end-22228m",
      "kind": "connector",
      "connector": "cmp-22222m/J1"
    },
    {
      "id": "end-22228p",
      "kind": "connector",
      "connector": "cmp-22222p/L1"
    },
    {
      "id": "end-22228q",
      "kind": "breakout",
      "spec": "breakouts/tape-transition"
    },
    {
      "id": "end-22228s",
      "kind": "connector",
      "connector": "cmp-22222p/L2"
    },
    {
      "id": "end-22228u",
      "kind": "connector",
      "connector": "cmp-22222p/L3"
    },
    {
      "id": "end-22228w",
      "kind": "connector",
      "connector": "cmp-22222p/L4"
    },
    {
      "id": "end-22228y",
      "kind": "connector",
      "connector": "cmp-22222p/L5"
    },
    {
      "id": "end-222292",
      "kind": "point"
    },
    {
      "id": "end-222294",
      "kind": "breakout",
      "spec": "breakouts/heatshrink-transition"
    },
    {
      "id": "end-222296",
      "kind": "connector",
      "connector": "cmp-22222q/PWR"
    },
    {
      "id": "end-222298",
      "kind": "connector",
      "connector": "cmp-22222t/PWR"
    },
    {
      "id": "end-22229a",
      "kind": "point"
    },
    {
      "id": "end-22229c",
      "kind": "breakout",
      "spec": "breakouts/heatshrink-transition"
    },
    {
      "id": "end-22229e",
      "kind": "connector",
      "connector": "cmp-22222h/PWR"
    },
    {
      "id": "end-22229g",
      "kind": "connector",
      "connector": "cmp-22222e/IN"
    },
    {
      "id": "end-22229j",
      "kind": "connector",
      "connector": "cmp-22222j/PWR"
    },
    {
      "id": "end-22229r",
      "kind": "connector",
      "connector": "cmp-22222p/L6"
    },
    {
      "id": "end-22229s",
      "kind": "breakout",
      "spec": "breakouts/tape-transition"
    },
    {
      "id": "end-22229u",
      "kind": "connector",
      "connector": "cmp-22222p/L7"
    },
    {
      "id": "end-22229w",
      "kind": "connector",
      "connector": "cmp-22222p/L8"
    },
    {
      "id": "end-22229y",
      "kind": "connector",
      "connector": "cmp-22222p/L9"
    },
    {
      "id": "end-2222a2",
      "kind": "connector",
      "connector": "cmp-22222p/L10"
    },
    {
      "id": "end-2222a4",
      "kind": "point"
    },
    {
      "id": "end-2222a6",
      "kind": "breakout",
      "spec": "breakouts/heatshrink-transition"
    },
    {
      "id": "end-2222a8",
      "kind": "connector",
      "connector": "cmp-22222w/PWR"
    },
    {
      "id": "end-2222aa",
      "kind": "connector",
      "connector": "cmp-22222z/PWR"
    },
    {
      "id": "end-2222ac",
      "kind": "point"
    },
    {
      "id": "end-2222ae",
      "kind": "breakout",
      "spec": "breakouts/heatshrink-transition"
    },
    {
      "id": "end-2222ag",
      "kind": "connector",
      "connector": "cmp-222234/PWR"
    },
    {
      "id": "end-2222aj",
      "kind": "connector",
      "connector": "cmp-222235/PWR"
    },
    {
      "id": "end-2222am",
      "kind": "connector",
      "connector": "cmp-222236/PWR"
    },
    {
      "id": "end-2222aq",
      "kind": "connector",
      "connector": "cmp-22222j/AIN1"
    },
    {
      "id": "end-2222ar",
      "kind": "breakout",
      "spec": "breakouts/heatshrink-transition"
    },
    {
      "id": "end-2222at",
      "kind": "connector",
      "connector": "cmp-22222j/ENC1"
    },
    {
      "id": "end-2222av",
      "kind": "connector",
      "connector": "cmp-22222j/DIO1"
    },
    {
      "id": "end-2222ax",
      "kind": "connector",
      "connector": "cmp-22222j/AIN2"
    },
    {
      "id": "end-2222az",
      "kind": "connector",
      "connector": "cmp-22222j/ENC2"
    },
    {
      "id": "end-2222b3",
      "kind": "connector",
      "connector": "cmp-22222j/DIO2"
    },
    {
      "id": "end-2222b5",
      "kind": "connector",
      "connector": "cmp-22222j/AIN3"
    },
    {
      "id": "end-2222b7",
      "kind": "connector",
      "connector": "cmp-22222j/ENC3"
    },
    {
      "id": "end-2222b9",
      "kind": "connector",
      "connector": "cmp-22222j/DIO3"
    },
    {
      "id": "end-2222bb",
      "kind": "connector",
      "connector": "cmp-22222j/AIN4"
    },
    {
      "id": "end-2222bd",
      "kind": "connector",
      "connector": "cmp-22222j/ENC4"
    },
    {
      "id": "end-2222bf",
      "kind": "connector",
      "connector": "cmp-22222j/DIO4"
    },
    {
      "id": "end-2222bh",
      "kind": "point"
    },
    {
      "id": "end-2222bk",
      "kind": "breakout"
    },
    {
      "id": "end-2222bn",
      "kind": "breakout",
      "spec": "breakouts/tape-transition"
    },
    {
      "id": "end-2222bq",
      "kind": "connector",
      "connector": "cmp-22223k/J1"
    },
    {
      "id": "end-2222bs",
      "kind": "connector",
      "connector": "cmp-22223m/J1"
    },
    {
      "id": "end-2222bu",
      "kind": "connector",